{"$schema":"https://json-schema.org/draft/2020-12/schema","$id":"project-constitution.v1","type":"object","additionalProperties":false,"required":["schema_version","project_id","constitution_version","status","north_star","authority_model","operating_profile","constitutional_controls","protected_actions","completion_rule","source_profile"],"properties":{"schema_version":{"const":"project-constitution.v1"},"project_id":{"type":"string","minLength":1},"constitution_version":{"type":"string","minLength":1},"status":{"type":"string","minLength":1},"north_star":{"type":"object","additionalProperties":false,"required":["id","statement","change_policy"],"properties":{"id":{"type":"string","minLength":1},"statement":{"type":"string","minLength":20},"change_policy":{"type":"string","minLength":1}}},"authority_model":{"type":"object","additionalProperties":false,"required":["project_owner","ai_technical_authority","evidence_authority"],"properties":{"project_owner":{"type":"array","items":{"type":"string","minLength":1},"uniqueItems":true,"minItems":1},"ai_technical_authority":{"type":"array","items":{"type":"string","minLength":1},"uniqueItems":true,"minItems":1},"evidence_authority":{"type":"array","items":{"type":"string","minLength":1},"uniqueItems":true,"minItems":1}}},"operating_profile":{"type":"object","additionalProperties":false,"required":["ownership","owner_technical_profile","ai_operated","security_priority","review_profile","merge_profile","default_owner_language","default_agent_contract_language"],"properties":{"ownership":{"type":"string","minLength":1},"owner_technical_profile":{"type":"string","minLength":1},"ai_operated":{"type":"boolean"},"security_priority":{"const":"low_with_mandatory_safety_floor"},"review_profile":{"type":"string","minLength":1},"merge_profile":{"type":"string","minLength":1},"default_owner_language":{"type":"string","minLength":1},"default_agent_contract_language":{"type":"string","minLength":1}}},"constitutional_controls":{"type":"array","items":{"type":"string","minLength":1},"uniqueItems":true,"minItems":1},"protected_actions":{"type":"array","items":{"type":"string","minLength":1},"uniqueItems":true,"minItems":1},"completion_rule":{"type":"object","additionalProperties":false,"required":["required_lifecycle_state","evidence_required","agent_claim_alone_is_sufficient"],"properties":{"required_lifecycle_state":{"const":"current_main_verified"},"evidence_required":{"const":true},"agent_claim_alone_is_sufficient":{"const":false}}},"source_profile":{"type":"object","additionalProperties":false,"required":["name","source_version","adoption_mode","bundle_sha256","ssot_sha256","personal_profile_sha256","full_enforcement_claimed"],"properties":{"name":{"type":"string","minLength":1},"source_version":{"type":"string","minLength":1},"adoption_mode":{"type":"string","minLength":1},"bundle_sha256":{"type":"string","pattern":"^[0-9a-f]{64}$"},"ssot_sha256":{"type":"string","pattern":"^[0-9a-f]{64}$"},"personal_profile_sha256":{"type":"string","pattern":"^[0-9a-f]{64}$"},"full_enforcement_claimed":{"type":"boolean"}}}}}